{
  "id": "SUC-036-MEDIA",
  "type": "route-media",
  "schemaVersion": "1.0.0",
  "eventId": "SUC-036",
  "routeId": "SUC-036",
  "distanceVariantId": "XL",
  "title": "SUC 036 XL Cinematic Flyover",
  "description": "Canonical cinematic plan for long-form route preview.",
  "playback": {
    "milesPerSecond": 1.1,
    "fps": 24,
    "holdSeconds": 0.75,
    "outputFormat": "story"
  },
  "camera": {
    "mode": "third-person-follow",
    "followDistanceMeters": 120,
    "altitudeMeters": 90,
    "pitchDeg": 58,
    "headingOffsetDeg": 0
  },
  "timeline": [
    {
      "id": "intro-roll",
      "startMi": 0,
      "endMi": 2.5,
      "cameraMode": "overview-lock",
      "speedMiPerSec": 0.8,
      "title": "Start and Settle In",
      "subtitleIds": ["sub-intro"],
      "markerIds": ["m-start", "m-water-crew"]
    },
    {
      "id": "main-climb",
      "startMi": 2.5,
      "endMi": 8.9,
      "cameraMode": "third-person-follow",
      "speedMiPerSec": 1,
      "title": "Loma Alta Climb",
      "subtitleIds": ["sub-climb"],
      "markerIds": ["m-summit"]
    },
    {
      "id": "descent-home",
      "startMi": 8.9,
      "endMi": 12.6,
      "cameraMode": "third-person-follow",
      "speedMiPerSec": 1.3,
      "title": "Descent and Finish",
      "subtitleIds": ["sub-finish"],
      "markerIds": ["m-finish"]
    }
  ],
  "subtitles": [
    {
      "id": "sub-intro",
      "startSec": 0,
      "endSec": 8,
      "text": "Smooth rollout from the trailhead.",
      "position": "bottom"
    },
    {
      "id": "sub-climb",
      "startSec": 9,
      "endSec": 22,
      "text": "Steady climb. Keep cadence stable.",
      "position": "bottom"
    },
    {
      "id": "sub-finish",
      "startSec": 23,
      "endSec": 36,
      "text": "Fast descent into final regroup.",
      "position": "bottom"
    }
  ],
  "markers": [
    {
      "id": "m-start",
      "atMi": 0,
      "type": "title",
      "title": "Start"
    },
    {
      "id": "m-water-crew",
      "atMi": 4.3,
      "type": "poi",
      "title": "Crew Water Drop",
      "body": "Water and quick check-in.",
      "poiId": "water-crew-water-drop"
    },
    {
      "id": "m-summit",
      "atMi": 7.1,
      "type": "poi",
      "title": "Loma Alta Summit",
      "poiId": "summit-loma-alta"
    },
    {
      "id": "m-finish",
      "atMi": 12.6,
      "type": "title",
      "title": "Finish"
    }
  ],
  "visibility": "public",
  "publish": true,
  "status": "active",
  "createdAt": "2026-02-14T12:00:00.000Z",
  "updatedAt": "2026-02-14T12:00:00.000Z"
}
